{
  "version": "1.0",
  "id": "starter-release-preparation",
  "goal": "Prepare a read-only release-readiness report from repository evidence without tagging, publishing, or changing external state.",
  "originalPromptHash": "793c4164dce699c79bfa2e4302697cf7e120c89b132cf5439204f25fe7ffafb0",
  "autonomy": "read_only",
  "createdAt": "2026-07-24T00:00:00.000Z",
  "budgets": {
    "maxNodes": 5,
    "maxParallel": 2,
    "maxFanout": 4,
    "maxDepth": 4,
    "maxRepairRounds": 0,
    "timeoutMs": 600000,
    "maxEstimatedTokens": 80000,
    "maxActualTokens": 200000
  },
  "nodes": [
    {
      "id": "scope",
      "label": "Select release evidence areas",
      "kind": "agent",
      "dependsOn": [],
      "permission": "read",
      "executor": "codex",
      "prompt": "Return at most four bounded release-readiness evidence areas as JSON {\"items\":[{\"id\":\"...\",\"task\":\"...\"}]}. Include version consistency, deterministic gates, documentation, and artifact privacy. Do not change state.",
      "outputSchema": {
        "type": "object",
        "required": ["items"],
        "properties": {
          "items": {
            "type": "array",
            "maxItems": 4,
            "items": {
              "type": "object",
              "required": ["id", "task"],
              "properties": {
                "id": { "type": "string" },
                "task": { "type": "string" }
              }
            }
          }
        }
      }
    },
    {
      "id": "inspect",
      "label": "Inspect release evidence independently",
      "kind": "parallel_map",
      "dependsOn": ["scope"],
      "permission": "read",
      "executor": "codex",
      "prompt": "Inspect only this evidence area. Return exact repository evidence, pass or fail status, uncertainty, and a deterministic verification command. Do not tag, publish, modify files, or access credentials.",
      "inputPath": "items",
      "maxConcurrency": 2
    },
    {
      "id": "collect",
      "label": "Collect release evidence",
      "kind": "reduce",
      "dependsOn": ["inspect"],
      "permission": "none",
      "operation": "dedupe"
    },
    {
      "id": "verify",
      "label": "Verify release readiness report",
      "kind": "verifier",
      "dependsOn": ["collect"],
      "permission": "read",
      "executor": "claude",
      "prompt": "Try to disprove every readiness claim against the cited repository files and commands. Return JSON with accepted and reasons. This verifies preparation only and must not release anything.",
      "outputSchema": {
        "type": "object",
        "required": ["accepted", "reasons"],
        "properties": {
          "accepted": { "type": "boolean" },
          "reasons": {
            "type": "array",
            "items": { "type": "string" }
          }
        }
      }
    }
  ],
  "metadata": {
    "example": true,
    "workflow": "release-preparation",
    "sideEffects": false,
    "provenance": "repository-maintained"
  }
}
